{"assignedAt":"2026-09-03T17:14:43Z","assignmentId":"eiron-morek-combat-chibi-v1-assignment","completionContract":{"candidateOnly":true,"oneTargetOneImage":true,"selfPromotionForbidden":true,"sharedFilesMustRemainUntouched":true,"structuredResultRequired":true},"dryRun":false,"experimentId":"one-star-overnight-200-001","forbiddenSharedPaths":["assets/heroes/experiments/one-star-overnight-200-001/production-report.json","assets/heroes/experiments/one-star-overnight-200-001/provenance/production-journal.jsonl","assets/heroes/experiments/one-star-overnight-200-001/review/index.html","assets/heroes/experiments/one-star-overnight-200-001/review/quarantine.html","assets/heroes/experiments/one-star-overnight-200-001/roster-plan.json"],"permittedOutputs":{"candidatePath":"assets/heroes/experiments/one-star-overnight-200-001/waves/wave-06/candidates/eiron-morek/combat-chibi-v1.png","resultPath":"assets/heroes/experiments/one-star-overnight-200-001/waves/wave-06/results/eiron-morek/combat-chibi-v1.json"},"producerId":"producer-eiron-chibi","retryCeiling":1,"schemaVersion":"hero-one-star-image-assignment-v1","targetId":"eiron-morek-combat-chibi-v1","targetPath":"assets/heroes/experiments/one-star-overnight-200-001/waves/wave-06/targets/eiron-morek/combat-chibi-v1.json","targetSha256":"14490ee03560bcc9a3a382cdf8f1d131e0f249ae3427b4182db15542b51a07b8"}
