{"assignedAt":"2026-09-03T22:35:00Z","assignmentId":"ianen-tavek-summon-v1-assignment","completionContract":{"candidateOnly":true,"oneTargetOneImage":true,"selfPromotionForbidden":true,"sharedFilesMustRemainUntouched":true,"structuredResultRequired":true},"dryRun":false,"experimentId":"one-star-overnight-200-001","forbiddenSharedPaths":["assets/heroes/experiments/one-star-overnight-200-001/production-report.json","assets/heroes/experiments/one-star-overnight-200-001/provenance/production-journal.jsonl","assets/heroes/experiments/one-star-overnight-200-001/review/index.html","assets/heroes/experiments/one-star-overnight-200-001/review/quarantine.html","assets/heroes/experiments/one-star-overnight-200-001/roster-plan.json"],"permittedOutputs":{"candidatePath":"assets/heroes/experiments/one-star-overnight-200-001/waves/wave-09/candidates/ianen-tavek/summon-v1.png","resultPath":"assets/heroes/experiments/one-star-overnight-200-001/waves/wave-09/results/ianen-tavek/summon-v1.json"},"producerId":"prod-ai","retryCeiling":1,"schemaVersion":"hero-one-star-image-assignment-v1","targetId":"ianen-tavek-summon-v1","targetPath":"assets/heroes/experiments/one-star-overnight-200-001/waves/wave-09/targets/ianen-tavek/summon-v1.json","targetSha256":"e10571e499638ac041c22fa2511f521d7c1ba843ef71886ce1c696d090b632fb"}
