{"assignedAt":"2026-09-03T07:46:55Z","assignmentId":"kelor-reshel-summon-v1-assignment","completionContract":{"candidateOnly":true,"oneTargetOneImage":true,"selfPromotionForbidden":true,"sharedFilesMustRemainUntouched":true,"structuredResultRequired":true},"dryRun":false,"experimentId":"one-star-overnight-200-001","forbiddenSharedPaths":["assets/heroes/experiments/one-star-overnight-200-001/production-report.json","assets/heroes/experiments/one-star-overnight-200-001/provenance/production-journal.jsonl","assets/heroes/experiments/one-star-overnight-200-001/review/index.html","assets/heroes/experiments/one-star-overnight-200-001/review/quarantine.html","assets/heroes/experiments/one-star-overnight-200-001/roster-plan.json"],"permittedOutputs":{"candidatePath":"assets/heroes/experiments/one-star-overnight-200-001/waves/wave-03/candidates/kelor-reshel/summon-v1.png","resultPath":"assets/heroes/experiments/one-star-overnight-200-001/waves/wave-03/results/kelor-reshel/summon-v1.json"},"producerId":"image-producer-lane-07","retryCeiling":1,"schemaVersion":"hero-one-star-image-assignment-v1","targetId":"kelor-reshel-summon-v1","targetPath":"assets/heroes/experiments/one-star-overnight-200-001/waves/wave-03/targets/kelor-reshel/summon-v1.json","targetSha256":"774aef0d8fc3a2406872d4bc190a4b4e30f84b01a1590fc17ba0af7ed98c6d34"}
