{"assignedAt":"2026-09-04T00:28:00-07:00","assignmentId":"ianu-lora-combat-chibi-v1-assignment","completionContract":{"candidateOnly":true,"oneTargetOneImage":true,"selfPromotionForbidden":true,"sharedFilesMustRemainUntouched":true,"structuredResultRequired":true},"dryRun":false,"experimentId":"one-star-overnight-200-001","forbiddenSharedPaths":["assets/heroes/experiments/one-star-overnight-200-001/production-report.json","assets/heroes/experiments/one-star-overnight-200-001/provenance/production-journal.jsonl","assets/heroes/experiments/one-star-overnight-200-001/review/index.html","assets/heroes/experiments/one-star-overnight-200-001/review/quarantine.html","assets/heroes/experiments/one-star-overnight-200-001/roster-plan.json"],"permittedOutputs":{"candidatePath":"assets/heroes/experiments/one-star-overnight-200-001/waves/wave-05/candidates/ianu-lora/combat-chibi-v1.png","resultPath":"assets/heroes/experiments/one-star-overnight-200-001/waves/wave-05/results/ianu-lora/combat-chibi-v1.json"},"producerId":"resume-lani","retryCeiling":1,"schemaVersion":"hero-one-star-image-assignment-v1","targetId":"ianu-lora-combat-chibi-v1","targetPath":"assets/heroes/experiments/one-star-overnight-200-001/waves/wave-05/targets/ianu-lora/combat-chibi-v1.json","targetSha256":"11795bd0f8652510ab8da5597d82c11b8ca272a464c0b6be69437f6fd7b20f7d"}
