{"assignedAt":"2026-09-03T20:35:00Z","assignmentId":"assignment-galo-amarai-summon-v2","completionContract":{"candidateOnly":true,"oneTargetOneImage":true,"selfPromotionForbidden":true,"sharedFilesMustRemainUntouched":true,"structuredResultRequired":true},"dryRun":false,"experimentId":"one-star-overnight-200-001","forbiddenSharedPaths":["assets/heroes/experiments/one-star-overnight-200-001/production-report.json","assets/heroes/experiments/one-star-overnight-200-001/provenance/production-journal.jsonl","assets/heroes/experiments/one-star-overnight-200-001/review/index.html","assets/heroes/experiments/one-star-overnight-200-001/review/quarantine.html","assets/heroes/experiments/one-star-overnight-200-001/roster-plan.json"],"permittedOutputs":{"candidatePath":"assets/heroes/experiments/one-star-overnight-200-001/waves/wave-04/candidates/galo-amarai/summon-v2.png","resultPath":"assets/heroes/experiments/one-star-overnight-200-001/waves/wave-04/results/galo-amarai/summon-v2.json"},"producerId":"resume-talyn","retryCeiling":1,"schemaVersion":"hero-one-star-image-assignment-v1","targetId":"galo-amarai-summon-v2","targetPath":"assets/heroes/experiments/one-star-overnight-200-001/waves/wave-04/targets/galo-amarai/summon-v2.json","targetSha256":"0e5d35f9d2333f0882b892ee45d3a5c797502f16221c77ca335da9d43ba22a05"}
