{"assignedAt":"2026-09-04T02:13:42Z","assignmentId":"assignment-calor-orar-combat-chibi-v2","completionContract":{"candidateOnly":true,"oneTargetOneImage":true,"selfPromotionForbidden":true,"sharedFilesMustRemainUntouched":true,"structuredResultRequired":true},"dryRun":false,"experimentId":"one-star-overnight-200-001","forbiddenSharedPaths":["assets/heroes/experiments/one-star-overnight-200-001/production-report.json","assets/heroes/experiments/one-star-overnight-200-001/provenance/production-journal.jsonl","assets/heroes/experiments/one-star-overnight-200-001/review/index.html","assets/heroes/experiments/one-star-overnight-200-001/review/quarantine.html","assets/heroes/experiments/one-star-overnight-200-001/roster-plan.json"],"permittedOutputs":{"candidatePath":"assets/heroes/experiments/one-star-overnight-200-001/waves/wave-06/candidates/calor-orar/combat-chibi-v2.png","resultPath":"assets/heroes/experiments/one-star-overnight-200-001/waves/wave-06/results/calor-orar/combat-chibi-v2.json"},"producerId":"resume-calen","retryCeiling":1,"schemaVersion":"hero-one-star-image-assignment-v1","targetId":"calor-orar-combat-chibi-v2","targetPath":"assets/heroes/experiments/one-star-overnight-200-001/waves/wave-06/targets/calor-orar/combat-chibi-v2.json","targetSha256":"efe7750dd2a441b9d5dc65341a66f47515a68d7030c7686b8f61c87db5c4dc23"}
