{"assignedAt":"2026-09-03T14:00:00Z","assignmentId":"assignment-wenan-corin-combat-chibi-v2","completionContract":{"candidateOnly":true,"oneTargetOneImage":true,"selfPromotionForbidden":true,"sharedFilesMustRemainUntouched":true,"structuredResultRequired":true},"dryRun":false,"experimentId":"one-star-overnight-200-001","forbiddenSharedPaths":["assets/heroes/experiments/one-star-overnight-200-001/production-report.json","assets/heroes/experiments/one-star-overnight-200-001/provenance/production-journal.jsonl","assets/heroes/experiments/one-star-overnight-200-001/review/index.html","assets/heroes/experiments/one-star-overnight-200-001/review/quarantine.html","assets/heroes/experiments/one-star-overnight-200-001/roster-plan.json"],"permittedOutputs":{"candidatePath":"assets/heroes/experiments/one-star-overnight-200-001/waves/wave-04/candidates/wenan-corin/combat-chibi-v2.png","resultPath":"assets/heroes/experiments/one-star-overnight-200-001/waves/wave-04/results/wenan-corin/combat-chibi-v2.json"},"producerId":"coordinator-wave04-wenan-chibi-correction","retryCeiling":1,"schemaVersion":"hero-one-star-image-assignment-v1","targetId":"wenan-corin-combat-chibi-v2","targetPath":"assets/heroes/experiments/one-star-overnight-200-001/waves/wave-04/targets/wenan-corin/combat-chibi-v2.json","targetSha256":"fe7a4b0e69728d7fb4a97cfb828c569c8b30b68a88ecdb4f66f5f1720c58ce1c"}
