{"assignedAt":"2026-09-03T19:10:00Z","assignmentId":"quinyn-ulenel-summon-v1-assignment","completionContract":{"candidateOnly":true,"oneTargetOneImage":true,"selfPromotionForbidden":true,"sharedFilesMustRemainUntouched":true,"structuredResultRequired":true},"dryRun":false,"experimentId":"one-star-overnight-200-001","forbiddenSharedPaths":["assets/heroes/experiments/one-star-overnight-200-001/production-report.json","assets/heroes/experiments/one-star-overnight-200-001/provenance/production-journal.jsonl","assets/heroes/experiments/one-star-overnight-200-001/review/index.html","assets/heroes/experiments/one-star-overnight-200-001/review/quarantine.html","assets/heroes/experiments/one-star-overnight-200-001/roster-plan.json"],"permittedOutputs":{"candidatePath":"assets/heroes/experiments/one-star-overnight-200-001/waves/wave-09/candidates/quinyn-ulenel/summon-v1.png","resultPath":"assets/heroes/experiments/one-star-overnight-200-001/waves/wave-09/results/quinyn-ulenel/summon-v1.json"},"producerId":"prod-i","retryCeiling":1,"schemaVersion":"hero-one-star-image-assignment-v1","targetId":"quinyn-ulenel-summon-v1","targetPath":"assets/heroes/experiments/one-star-overnight-200-001/waves/wave-09/targets/quinyn-ulenel/summon-v1.json","targetSha256":"b157161fe2c49e671ab2fddd442d85ff223845a6d93783b4982eb26a7fbf7fa8"}
