{"assignedAt":"2026-09-03T19:44:00Z","assignmentId":"iana-grelor-summon-v1-assignment","completionContract":{"candidateOnly":true,"oneTargetOneImage":true,"selfPromotionForbidden":true,"sharedFilesMustRemainUntouched":true,"structuredResultRequired":true},"dryRun":false,"experimentId":"one-star-overnight-200-001","forbiddenSharedPaths":["assets/heroes/experiments/one-star-overnight-200-001/production-report.json","assets/heroes/experiments/one-star-overnight-200-001/provenance/production-journal.jsonl","assets/heroes/experiments/one-star-overnight-200-001/review/index.html","assets/heroes/experiments/one-star-overnight-200-001/review/quarantine.html","assets/heroes/experiments/one-star-overnight-200-001/roster-plan.json"],"permittedOutputs":{"candidatePath":"assets/heroes/experiments/one-star-overnight-200-001/waves/wave-06/candidates/iana-grelor/summon-v1.png","resultPath":"assets/heroes/experiments/one-star-overnight-200-001/waves/wave-06/results/iana-grelor/summon-v1.json"},"producerId":"resume-peror","retryCeiling":1,"schemaVersion":"hero-one-star-image-assignment-v1","targetId":"iana-grelor-summon-v1","targetPath":"assets/heroes/experiments/one-star-overnight-200-001/waves/wave-06/targets/iana-grelor/summon-v1.json","targetSha256":"e4d9385308d9beb05d656fe9ef008cabc1328c47287c4f7253ac35b2a698121a"}
