{"assignedAt":"2026-09-03T21:13:00Z","assignmentId":"belar-quoren-summon-v1-assignment","completionContract":{"candidateOnly":true,"oneTargetOneImage":true,"selfPromotionForbidden":true,"sharedFilesMustRemainUntouched":true,"structuredResultRequired":true},"dryRun":false,"experimentId":"one-star-overnight-200-001","forbiddenSharedPaths":["assets/heroes/experiments/one-star-overnight-200-001/production-report.json","assets/heroes/experiments/one-star-overnight-200-001/provenance/production-journal.jsonl","assets/heroes/experiments/one-star-overnight-200-001/review/index.html","assets/heroes/experiments/one-star-overnight-200-001/review/quarantine.html","assets/heroes/experiments/one-star-overnight-200-001/roster-plan.json"],"permittedOutputs":{"candidatePath":"assets/heroes/experiments/one-star-overnight-200-001/waves/wave-05/candidates/belar-quoren/summon-v1.png","resultPath":"assets/heroes/experiments/one-star-overnight-200-001/waves/wave-05/results/belar-quoren/summon-v1.json"},"producerId":"resume-talyn","retryCeiling":1,"schemaVersion":"hero-one-star-image-assignment-v1","targetId":"belar-quoren-summon-v1","targetPath":"assets/heroes/experiments/one-star-overnight-200-001/waves/wave-05/targets/belar-quoren/summon-v1.json","targetSha256":"9f818443f3d876e4ae16beab6cf499d1839866d77f82f2a8bdf9590cef02e4f7"}
