{"assignedAt":"2026-09-04T01:02:00Z","assignmentId":"oris-esheth-summon-v1-assignment","completionContract":{"candidateOnly":true,"oneTargetOneImage":true,"selfPromotionForbidden":true,"sharedFilesMustRemainUntouched":true,"structuredResultRequired":true},"dryRun":false,"experimentId":"one-star-overnight-200-001","forbiddenSharedPaths":["assets/heroes/experiments/one-star-overnight-200-001/production-report.json","assets/heroes/experiments/one-star-overnight-200-001/provenance/production-journal.jsonl","assets/heroes/experiments/one-star-overnight-200-001/review/index.html","assets/heroes/experiments/one-star-overnight-200-001/review/quarantine.html","assets/heroes/experiments/one-star-overnight-200-001/roster-plan.json"],"permittedOutputs":{"candidatePath":"assets/heroes/experiments/one-star-overnight-200-001/waves/wave-09/candidates/oris-esheth/summon-v1.png","resultPath":"assets/heroes/experiments/one-star-overnight-200-001/waves/wave-09/results/oris-esheth/summon-v1.json"},"producerId":"prod-seno","retryCeiling":1,"schemaVersion":"hero-one-star-image-assignment-v1","targetId":"oris-esheth-summon-v1","targetPath":"assets/heroes/experiments/one-star-overnight-200-001/waves/wave-09/targets/oris-esheth/summon-v1.json","targetSha256":"50d83431b1c18c8322e80c402dbe39920b83cc2141082232fb90eb9dca0d6eab"}
