{"assignedAt":"2026-09-03T19:30:00Z","assignmentId":"meian-ulenan-summon-v1-assignment","completionContract":{"candidateOnly":true,"oneTargetOneImage":true,"selfPromotionForbidden":true,"sharedFilesMustRemainUntouched":true,"structuredResultRequired":true},"dryRun":false,"experimentId":"one-star-overnight-200-001","forbiddenSharedPaths":["assets/heroes/experiments/one-star-overnight-200-001/production-report.json","assets/heroes/experiments/one-star-overnight-200-001/provenance/production-journal.jsonl","assets/heroes/experiments/one-star-overnight-200-001/review/index.html","assets/heroes/experiments/one-star-overnight-200-001/review/quarantine.html","assets/heroes/experiments/one-star-overnight-200-001/roster-plan.json"],"permittedOutputs":{"candidatePath":"assets/heroes/experiments/one-star-overnight-200-001/waves/wave-09/candidates/meian-ulenan/summon-v1.png","resultPath":"assets/heroes/experiments/one-star-overnight-200-001/waves/wave-09/results/meian-ulenan/summon-v1.json"},"producerId":"prod-o","retryCeiling":1,"schemaVersion":"hero-one-star-image-assignment-v1","targetId":"meian-ulenan-summon-v1","targetPath":"assets/heroes/experiments/one-star-overnight-200-001/waves/wave-09/targets/meian-ulenan/summon-v1.json","targetSha256":"dafb2b59b1bba8efc47d6c909fbb70ffe8e18fd773716585be68e9043b0f005e"}
