{"assignedAt":"2026-09-04T02:04:04Z","assignmentId":"galyn-coren-summon-v1-assignment","completionContract":{"candidateOnly":true,"oneTargetOneImage":true,"selfPromotionForbidden":true,"sharedFilesMustRemainUntouched":true,"structuredResultRequired":true},"dryRun":false,"experimentId":"one-star-overnight-200-001","forbiddenSharedPaths":["assets/heroes/experiments/one-star-overnight-200-001/production-report.json","assets/heroes/experiments/one-star-overnight-200-001/provenance/production-journal.jsonl","assets/heroes/experiments/one-star-overnight-200-001/review/index.html","assets/heroes/experiments/one-star-overnight-200-001/review/quarantine.html","assets/heroes/experiments/one-star-overnight-200-001/roster-plan.json"],"permittedOutputs":{"candidatePath":"assets/heroes/experiments/one-star-overnight-200-001/waves/wave-06/candidates/galyn-coren/summon-v1.png","resultPath":"assets/heroes/experiments/one-star-overnight-200-001/waves/wave-06/results/galyn-coren/summon-v1.json"},"producerId":"resume-lano","retryCeiling":1,"schemaVersion":"hero-one-star-image-assignment-v1","targetId":"galyn-coren-summon-v1","targetPath":"assets/heroes/experiments/one-star-overnight-200-001/waves/wave-06/targets/galyn-coren/summon-v1.json","targetSha256":"b84b057975383a6d140cacada7397a7b8a43a2cc07e4315b4583155656cba5ab"}
