{
  "assignedAt": "2026-09-02T00:00:00Z",
  "assignmentId": "elin-orin-summon-v1-assignment",
  "completionContract": {
    "candidateOnly": true,
    "oneTargetOneImage": true,
    "selfPromotionForbidden": true,
    "sharedFilesMustRemainUntouched": true,
    "structuredResultRequired": true
  },
  "dryRun": false,
  "experimentId": "one-star-overnight-200-001",
  "forbiddenSharedPaths": [
    "assets/heroes/experiments/one-star-overnight-200-001/roster-plan.json",
    "assets/heroes/experiments/one-star-overnight-200-001/production-report.json",
    "assets/heroes/experiments/one-star-overnight-200-001/provenance/production-journal.jsonl",
    "assets/heroes/experiments/one-star-overnight-200-001/review/index.html",
    "assets/heroes/experiments/one-star-overnight-200-001/review/quarantine.html"
  ],
  "permittedOutputs": {
    "candidatePath": "assets/heroes/experiments/one-star-overnight-200-001/waves/wave-01/candidates/elin-orin/summon-v1.png",
    "resultPath": "assets/heroes/experiments/one-star-overnight-200-001/waves/wave-01/results/elin-orin/summon-v1.json"
  },
  "producerId": "image-producer-lane-04",
  "retryCeiling": 1,
  "schemaVersion": "hero-one-star-image-assignment-v1",
  "targetId": "elin-orin-summon-v1",
  "targetPath": "assets/heroes/experiments/one-star-overnight-200-001/waves/wave-01/targets/elin-orin/summon-v1.json",
  "targetSha256": "a4c4aa4ef1c1873ebbeb919f333731d7b049924d4f79751bed4f69675b7da470"
}
