{"assignedAt":"2026-09-03T20:05:01Z","assignmentId":"assignment-oria-coro-combat-chibi-v2","completionContract":{"candidateOnly":true,"oneTargetOneImage":true,"selfPromotionForbidden":true,"sharedFilesMustRemainUntouched":true,"structuredResultRequired":true},"dryRun":false,"experimentId":"one-star-overnight-200-001","forbiddenSharedPaths":["assets/heroes/experiments/one-star-overnight-200-001/production-report.json","assets/heroes/experiments/one-star-overnight-200-001/provenance/production-journal.jsonl","assets/heroes/experiments/one-star-overnight-200-001/review/index.html","assets/heroes/experiments/one-star-overnight-200-001/review/quarantine.html","assets/heroes/experiments/one-star-overnight-200-001/roster-plan.json"],"permittedOutputs":{"candidatePath":"assets/heroes/experiments/one-star-overnight-200-001/waves/wave-04/candidates/oria-coro/combat-chibi-v2.png","resultPath":"assets/heroes/experiments/one-star-overnight-200-001/waves/wave-04/results/oria-coro/combat-chibi-v2.json"},"producerId":"resume-peror","retryCeiling":1,"schemaVersion":"hero-one-star-image-assignment-v1","targetId":"oria-coro-combat-chibi-v2","targetPath":"assets/heroes/experiments/one-star-overnight-200-001/waves/wave-04/targets/oria-coro/combat-chibi-v2.json","targetSha256":"38f505627495c3d06e84d0c31d202e4eb0579446c5c846220713f31c1356f4b0"}
