{"assignedAt":"2026-09-03T16:17:00Z","assignmentId":"ulel-zharor-summon-v1-assignment","completionContract":{"candidateOnly":true,"oneTargetOneImage":true,"selfPromotionForbidden":true,"sharedFilesMustRemainUntouched":true,"structuredResultRequired":true},"dryRun":false,"experimentId":"one-star-overnight-200-001","forbiddenSharedPaths":["assets/heroes/experiments/one-star-overnight-200-001/production-report.json","assets/heroes/experiments/one-star-overnight-200-001/provenance/production-journal.jsonl","assets/heroes/experiments/one-star-overnight-200-001/review/index.html","assets/heroes/experiments/one-star-overnight-200-001/review/quarantine.html","assets/heroes/experiments/one-star-overnight-200-001/roster-plan.json"],"permittedOutputs":{"candidatePath":"assets/heroes/experiments/one-star-overnight-200-001/waves/wave-04/candidates/ulel-zharor/summon-v1.png","resultPath":"assets/heroes/experiments/one-star-overnight-200-001/waves/wave-04/results/ulel-zharor/summon-v1.json"},"producerId":"image-producer-lane-03","retryCeiling":1,"schemaVersion":"hero-one-star-image-assignment-v1","targetId":"ulel-zharor-summon-v1","targetPath":"assets/heroes/experiments/one-star-overnight-200-001/waves/wave-04/targets/ulel-zharor/summon-v1.json","targetSha256":"715a4570d97f5cbf4c3e07fa49a4ffb9b923e4c3d0ff6f5a2be05d518e19829d"}
