{
  "assignedAt": "2026-09-02T00:00:00Z",
  "assignmentId": "rain-ulenen-summon-v1-assignment",
  "completionContract": {
    "candidateOnly": true,
    "oneTargetOneImage": true,
    "selfPromotionForbidden": true,
    "sharedFilesMustRemainUntouched": true,
    "structuredResultRequired": true
  },
  "dryRun": false,
  "experimentId": "one-star-overnight-200-001",
  "forbiddenSharedPaths": [
    "assets/heroes/experiments/one-star-overnight-200-001/roster-plan.json",
    "assets/heroes/experiments/one-star-overnight-200-001/production-report.json",
    "assets/heroes/experiments/one-star-overnight-200-001/provenance/production-journal.jsonl",
    "assets/heroes/experiments/one-star-overnight-200-001/review/index.html",
    "assets/heroes/experiments/one-star-overnight-200-001/review/quarantine.html"
  ],
  "permittedOutputs": {
    "candidatePath": "assets/heroes/experiments/one-star-overnight-200-001/waves/wave-01/candidates/rain-ulenen/summon-v1.png",
    "resultPath": "assets/heroes/experiments/one-star-overnight-200-001/waves/wave-01/results/rain-ulenen/summon-v1.json"
  },
  "producerId": "image-producer-lane-11",
  "retryCeiling": 1,
  "schemaVersion": "hero-one-star-image-assignment-v1",
  "targetId": "rain-ulenen-summon-v1",
  "targetPath": "assets/heroes/experiments/one-star-overnight-200-001/waves/wave-01/targets/rain-ulenen/summon-v1.json",
  "targetSha256": "71d4db7711ff13a9c2e33a92104c2bbe0525daa6a79e90541a68a5167d6b28e0"
}
