{"assignedAt":"2026-09-03T17:27:00Z","assignmentId":"belan-falin-summon-v1-assignment","completionContract":{"candidateOnly":true,"oneTargetOneImage":true,"selfPromotionForbidden":true,"sharedFilesMustRemainUntouched":true,"structuredResultRequired":true},"dryRun":false,"experimentId":"one-star-overnight-200-001","forbiddenSharedPaths":["assets/heroes/experiments/one-star-overnight-200-001/production-report.json","assets/heroes/experiments/one-star-overnight-200-001/provenance/production-journal.jsonl","assets/heroes/experiments/one-star-overnight-200-001/review/index.html","assets/heroes/experiments/one-star-overnight-200-001/review/quarantine.html","assets/heroes/experiments/one-star-overnight-200-001/roster-plan.json"],"permittedOutputs":{"candidatePath":"assets/heroes/experiments/one-star-overnight-200-001/waves/wave-08/candidates/belan-falin/summon-v1.png","resultPath":"assets/heroes/experiments/one-star-overnight-200-001/waves/wave-08/results/belan-falin/summon-v1.json"},"producerId":"resume-peri","retryCeiling":1,"schemaVersion":"hero-one-star-image-assignment-v1","targetId":"belan-falin-summon-v1","targetPath":"assets/heroes/experiments/one-star-overnight-200-001/waves/wave-08/targets/belan-falin/summon-v1.json","targetSha256":"e592a59c4411a325d4554b121b934df0849be266eeeed77ee25020647cf26669"}
