{"assignedAt":"2026-09-03T06:03:55Z","assignmentId":"seni-veshen-combat-chibi-v1-assignment","completionContract":{"candidateOnly":true,"oneTargetOneImage":true,"selfPromotionForbidden":true,"sharedFilesMustRemainUntouched":true,"structuredResultRequired":true},"dryRun":false,"experimentId":"one-star-overnight-200-001","forbiddenSharedPaths":["assets/heroes/experiments/one-star-overnight-200-001/production-report.json","assets/heroes/experiments/one-star-overnight-200-001/provenance/production-journal.jsonl","assets/heroes/experiments/one-star-overnight-200-001/review/index.html","assets/heroes/experiments/one-star-overnight-200-001/review/quarantine.html","assets/heroes/experiments/one-star-overnight-200-001/roster-plan.json"],"permittedOutputs":{"candidatePath":"assets/heroes/experiments/one-star-overnight-200-001/waves/wave-02/candidates/seni-veshen/combat-chibi-v1.png","resultPath":"assets/heroes/experiments/one-star-overnight-200-001/waves/wave-02/results/seni-veshen/combat-chibi-v1.json"},"producerId":"image-producer-lane-12","retryCeiling":1,"schemaVersion":"hero-one-star-image-assignment-v1","targetId":"seni-veshen-combat-chibi-v1","targetPath":"assets/heroes/experiments/one-star-overnight-200-001/waves/wave-02/targets/seni-veshen/combat-chibi-v1.json","targetSha256":"6817e7adf7937861865b6b2c8bab28e470d2587fb3e32dbeb4be1d288e9da84b"}
