{"assignedAt":"2026-09-03T07:39:55Z","assignmentId":"brinen-joro-combat-chibi-v1-assignment","completionContract":{"candidateOnly":true,"oneTargetOneImage":true,"selfPromotionForbidden":true,"sharedFilesMustRemainUntouched":true,"structuredResultRequired":true},"dryRun":false,"experimentId":"one-star-overnight-200-001","forbiddenSharedPaths":["assets/heroes/experiments/one-star-overnight-200-001/production-report.json","assets/heroes/experiments/one-star-overnight-200-001/provenance/production-journal.jsonl","assets/heroes/experiments/one-star-overnight-200-001/review/index.html","assets/heroes/experiments/one-star-overnight-200-001/review/quarantine.html","assets/heroes/experiments/one-star-overnight-200-001/roster-plan.json"],"permittedOutputs":{"candidatePath":"assets/heroes/experiments/one-star-overnight-200-001/waves/wave-03/candidates/brinen-joro/combat-chibi-v1.png","resultPath":"assets/heroes/experiments/one-star-overnight-200-001/waves/wave-03/results/brinen-joro/combat-chibi-v1.json"},"producerId":"image-producer-wave-03","retryCeiling":1,"schemaVersion":"hero-one-star-image-assignment-v1","targetId":"brinen-joro-combat-chibi-v1","targetPath":"assets/heroes/experiments/one-star-overnight-200-001/waves/wave-03/targets/brinen-joro/combat-chibi-v1.json","targetSha256":"93875f6592c738aefd6301aa579bc85d7627eff53a0f631af3bf0f494c8663ae"}
