{"assignedAt":"2026-09-04T00:43:00-07:00","assignmentId":"quina-eshin-summon-v1-assignment","completionContract":{"candidateOnly":true,"oneTargetOneImage":true,"selfPromotionForbidden":true,"sharedFilesMustRemainUntouched":true,"structuredResultRequired":true},"dryRun":false,"experimentId":"one-star-overnight-200-001","forbiddenSharedPaths":["assets/heroes/experiments/one-star-overnight-200-001/production-report.json","assets/heroes/experiments/one-star-overnight-200-001/provenance/production-journal.jsonl","assets/heroes/experiments/one-star-overnight-200-001/review/index.html","assets/heroes/experiments/one-star-overnight-200-001/review/quarantine.html","assets/heroes/experiments/one-star-overnight-200-001/roster-plan.json"],"permittedOutputs":{"candidatePath":"assets/heroes/experiments/one-star-overnight-200-001/waves/wave-04/candidates/quina-eshin/summon-v1.png","resultPath":"assets/heroes/experiments/one-star-overnight-200-001/waves/wave-04/results/quina-eshin/summon-v1.json"},"producerId":"resume-calen","retryCeiling":1,"schemaVersion":"hero-one-star-image-assignment-v1","targetId":"quina-eshin-summon-v1","targetPath":"assets/heroes/experiments/one-star-overnight-200-001/waves/wave-04/targets/quina-eshin/summon-v1.json","targetSha256":"dc2b93d92cea1cf111c5c9abac183cf9622a1cd00398a2d07dc9f5f8263d15f0"}
