{"assignedAt":"2026-09-03T17:12:51Z","assignmentId":"rain-morel-combat-chibi-v1-assignment","completionContract":{"candidateOnly":true,"oneTargetOneImage":true,"selfPromotionForbidden":true,"sharedFilesMustRemainUntouched":true,"structuredResultRequired":true},"dryRun":false,"experimentId":"one-star-overnight-200-001","forbiddenSharedPaths":["assets/heroes/experiments/one-star-overnight-200-001/production-report.json","assets/heroes/experiments/one-star-overnight-200-001/provenance/production-journal.jsonl","assets/heroes/experiments/one-star-overnight-200-001/review/index.html","assets/heroes/experiments/one-star-overnight-200-001/review/quarantine.html","assets/heroes/experiments/one-star-overnight-200-001/roster-plan.json"],"permittedOutputs":{"candidatePath":"assets/heroes/experiments/one-star-overnight-200-001/waves/wave-06/candidates/rain-morel/combat-chibi-v1.png","resultPath":"assets/heroes/experiments/one-star-overnight-200-001/waves/wave-06/results/rain-morel/combat-chibi-v1.json"},"producerId":"arbitrate-wave03-concerns","retryCeiling":1,"schemaVersion":"hero-one-star-image-assignment-v1","targetId":"rain-morel-combat-chibi-v1","targetPath":"assets/heroes/experiments/one-star-overnight-200-001/waves/wave-06/targets/rain-morel/combat-chibi-v1.json","targetSha256":"2b3583c4c21d6b55bae21d1d5c6a58d2ba51285d19de9018412b1ec59dcf029e"}
