{"assignedAt":"2026-09-03T05:16:00Z","assignmentId":"delu-iverel-combat-chibi-v1-assignment","completionContract":{"candidateOnly":true,"oneTargetOneImage":true,"selfPromotionForbidden":true,"sharedFilesMustRemainUntouched":true,"structuredResultRequired":true},"dryRun":false,"experimentId":"one-star-overnight-200-001","forbiddenSharedPaths":["assets/heroes/experiments/one-star-overnight-200-001/production-report.json","assets/heroes/experiments/one-star-overnight-200-001/provenance/production-journal.jsonl","assets/heroes/experiments/one-star-overnight-200-001/review/index.html","assets/heroes/experiments/one-star-overnight-200-001/review/quarantine.html","assets/heroes/experiments/one-star-overnight-200-001/roster-plan.json"],"permittedOutputs":{"candidatePath":"assets/heroes/experiments/one-star-overnight-200-001/waves/wave-01/candidates/delu-iverel/combat-chibi-v1.png","resultPath":"assets/heroes/experiments/one-star-overnight-200-001/waves/wave-01/results/delu-iverel/combat-chibi-v1.json"},"producerId":"image-producer-lane-09","retryCeiling":1,"schemaVersion":"hero-one-star-image-assignment-v1","targetId":"delu-iverel-combat-chibi-v1","targetPath":"assets/heroes/experiments/one-star-overnight-200-001/waves/wave-01/targets/delu-iverel/combat-chibi-v1.json","targetSha256":"f9911814dabfae3de5fb66b29791c3fdc2676e1cdbd49f2b8a89f2163ea16f12"}
