{"assignedAt":"2026-09-04T01:14:00-07:00","assignmentId":"pero-eshun-summon-v1-assignment","completionContract":{"candidateOnly":true,"oneTargetOneImage":true,"selfPromotionForbidden":true,"sharedFilesMustRemainUntouched":true,"structuredResultRequired":true},"dryRun":false,"experimentId":"one-star-overnight-200-001","forbiddenSharedPaths":["assets/heroes/experiments/one-star-overnight-200-001/production-report.json","assets/heroes/experiments/one-star-overnight-200-001/provenance/production-journal.jsonl","assets/heroes/experiments/one-star-overnight-200-001/review/index.html","assets/heroes/experiments/one-star-overnight-200-001/review/quarantine.html","assets/heroes/experiments/one-star-overnight-200-001/roster-plan.json"],"permittedOutputs":{"candidatePath":"assets/heroes/experiments/one-star-overnight-200-001/waves/wave-04/candidates/pero-eshun/summon-v1.png","resultPath":"assets/heroes/experiments/one-star-overnight-200-001/waves/wave-04/results/pero-eshun/summon-v1.json"},"producerId":"resume-calen","retryCeiling":1,"schemaVersion":"hero-one-star-image-assignment-v1","targetId":"pero-eshun-summon-v1","targetPath":"assets/heroes/experiments/one-star-overnight-200-001/waves/wave-04/targets/pero-eshun/summon-v1.json","targetSha256":"611f93c5215102019394930e558d2398f559e33fe1670635cf5b14d20667812a"}
